{
  "schema_version": "0.1.0",
  "paper": {
    "paper_id": "smoke_test_fixture",
    "title": "ClaimBench Smoke Test Fixture",
    "arxiv_id": "0000.00000",
    "paper_url": "https://example.com/smoke-test",
    "repo_url": "local://examples/fixtures/smoke_workspace",
    "repo_commit": "local-fixture",
    "domain": "fixture",
    "license": null,
    "hardware_profile": "cpu"
  },
  "claims": [
    {
      "claim_id": "smoke_claim_accuracy",
      "text": "The smoke fixture reports a deterministic accuracy metric.",
      "claim_type": "numeric_metric",
      "paper_location": "Fixture",
      "expected_metric": {
        "name": "accuracy",
        "value": 0.91,
        "unit": "accuracy",
        "higher_is_better": true
      },
      "tolerance": {
        "type": "absolute",
        "value": 0.001,
        "rationale": "The fixture writes a deterministic metric."
      },
      "linked_experiment_ids": [
        "smoke_exp_accuracy"
      ],
      "confidence": 1.0,
      "status": "executable"
    }
  ],
  "experiments": [
    {
      "experiment_id": "smoke_exp_accuracy",
      "name": "Smoke fixture accuracy run",
      "command": [
        "python",
        "write_metrics.py",
        "--output",
        "runs/smoke_metrics.json",
        "--accuracy",
        "0.91"
      ],
      "working_directory": ".",
      "expected_runtime_seconds": 5,
      "metric_parser": {
        "type": "json_path",
        "target": "$.accuracy"
      },
      "linked_claim_ids": [
        "smoke_claim_accuracy"
      ],
      "dataset_ids": [
        "smoke_dataset"
      ]
    }
  ],
  "environment": {
    "execution_mode": "manual",
    "base_image": "python:3.10-slim",
    "python_version": "3.10",
    "cuda_version": null,
    "dependency_files": [],
    "image_digest": null
  },
  "datasets": [
    {
      "dataset_id": "smoke_dataset",
      "name": "Synthetic smoke fixture",
      "source": "local fixture",
      "version": null,
      "sha256": null,
      "access_notes": "No external data required."
    }
  ],
  "cached_runs": [],
  "provenance": {
    "created_by": "ClaimBench fixture",
    "created_at": "2026-05-09",
    "extraction_model": null,
    "parser_version": null,
    "manual_edits": [
      "Fixture manifest for local run-experiment smoke testing."
    ],
    "review_status": "draft"
  },
  "validation": {
    "unresolved_fields": [],
    "notes": "This manifest is not a paper claim; it exists to smoke-test the local runner."
  }
}
