{
  "schema_version": "0.1.0",
  "paper": {
    "paper_id": "1234_56789",
    "title": "Smoke Test Paper",
    "arxiv_id": "1234.56789",
    "paper_url": "https://arxiv.org/abs/1234.56789",
    "repo_url": "https://github.com/example/repo",
    "repo_commit": "TODO: pin repository commit",
    "domain": "TODO: domain",
    "license": null,
    "hardware_profile": "TODO: cpu_or_gpu"
  },
  "claims": [
    {
      "claim_id": "1234_56789_claim_001",
      "text": "TODO: claim text from paper table or result section",
      "claim_type": "numeric_metric",
      "paper_location": "TODO: table/section/page",
      "evidence_snippet": "TODO: exact paper snippet supporting the claim",
      "expected_metric": {
        "name": "TODO: metric name",
        "value": "TODO: expected value",
        "unit": null,
        "higher_is_better": null
      },
      "tolerance": {
        "type": "manual",
        "value": "TODO: tolerance",
        "rationale": "TODO: why this tolerance is acceptable"
      },
      "linked_experiment_ids": [],
      "confidence": 0.0,
      "status": "unverified_candidate"
    }
  ],
  "experiments": [],
  "environment": {
    "execution_mode": "manual",
    "base_image": "TODO: base image",
    "python_version": "TODO: python version",
    "cuda_version": null,
    "dependency_files": [],
    "image_digest": null
  },
  "datasets": [],
  "cached_runs": [],
  "provenance": {
    "created_by": "claimbench init-paper",
    "created_at": "2026-05-04",
    "extraction_model": null,
    "parser_version": null,
    "manual_edits": [],
    "review_status": "draft"
  },
  "validation": {
    "unresolved_fields": [
      "paper.title",
      "paper.repo_commit",
      "paper.domain",
      "claims[0]",
      "experiments",
      "environment",
      "datasets"
    ],
    "notes": "Draft manifest generated by onboarding. Review and resolve TODO fields before execution."
  }
}
